{
  "kind":"autonomous-mutation-journal","schema_version":"v1","journal_id":"prompt-revert-journal","domain":"prompt","constitution_digest":"sha256:0000000000000000000000000000000000000000000000000000000000000000",
  "binding":{"mutation_id":"prompt-revert-mutation","attempt_id":"prompt-revert-attempt","controller_disarm_id":"prompt-revert-disarm","idempotency_key":"prompt-revert-idem","owner_identity":"prompt-owner","controller_identity":"prompt-controller","watchdog_identity":"prompt-watchdog","kill_switch_identity":"prompt-kill-switch","recovery_worker_identity":"prompt-revert-worker","risk_scope":"prompt","candidate_digest":"sha256:aaaaaaaaaaaaaaaaaaaaaaaaaaaaaaaaaaaaaaaaaaaaaaaaaaaaaaaaaaaaaaaa","config_digest":"sha256:bbbbbbbbbbbbbbbbbbbbbbbbbbbbbbbbbbbbbbbbbbbbbbbbbbbbbbbbbbbbbbbb","evidence_digest":"sha256:cccccccccccccccccccccccccccccccccccccccccccccccccccccccccccccccc","policy_digest":"sha256:dddddddddddddddddddddddddddddddddddddddddddddddddddddddddddddddd","baseline_digest":"sha256:eeeeeeeeeeeeeeeeeeeeeeeeeeeeeeeeeeeeeeeeeeeeeeeeeeeeeeeeeeeeeeee","postconditions_digest":"sha256:ffffffffffffffffffffffffffffffffffffffffffffffffffffffffffffffff","deadline":"2026-07-26T01:00:00Z","canary":{"scope_digest":"sha256:1111111111111111111111111111111111111111111111111111111111111111","target_count":1,"watch_deadline":"2026-07-26T00:30:00Z"},"recovery":{"class":"R-exact","worker_identity":"prompt-revert-worker","descriptor_digest":"sha256:2222222222222222222222222222222222222222222222222222222222222222","disarms_after_action":true}},
  "binding_digest":"sha256:0000000000000000000000000000000000000000000000000000000000000000",
  "entries":[
    {"entry_id":"prompt-revert-prepare","sequence":1,"recorded_at":"2026-07-26T00:00:00Z","phase":"prepare","outcome":"prepared","executor_identity":"prompt-controller","binding_digest":"sha256:0000000000000000000000000000000000000000000000000000000000000000","quarantine":{"state":"not-applicable","reason_digest":"sha256:3333333333333333333333333333333333333333333333333333333333333333"},"previous_receipt_digest":null,"receipt_digest":"sha256:0000000000000000000000000000000000000000000000000000000000000000","content_refs":["ref:prompt-revert-candidate"]},
    {"entry_id":"prompt-revert-apply","sequence":2,"recorded_at":"2026-07-26T00:05:00Z","phase":"apply","outcome":"applied","executor_identity":"prompt-controller","binding_digest":"sha256:0000000000000000000000000000000000000000000000000000000000000000","quarantine":{"state":"not-applicable","reason_digest":"sha256:3333333333333333333333333333333333333333333333333333333333333333"},"previous_receipt_digest":"sha256:0000000000000000000000000000000000000000000000000000000000000000","receipt_digest":"sha256:0000000000000000000000000000000000000000000000000000000000000000","content_refs":["ref:prompt-revert-candidate"]},
    {"entry_id":"prompt-revert-unknown","sequence":3,"recorded_at":"2026-07-26T01:01:00Z","phase":"unknown","outcome":"unknown","executor_identity":"prompt-controller","binding_digest":"sha256:0000000000000000000000000000000000000000000000000000000000000000","quarantine":{"state":"not-applicable","reason_digest":"sha256:3333333333333333333333333333333333333333333333333333333333333333"},"previous_receipt_digest":"sha256:0000000000000000000000000000000000000000000000000000000000000000","receipt_digest":"sha256:0000000000000000000000000000000000000000000000000000000000000000","content_refs":["ref:prompt-revert-candidate"]},
    {"entry_id":"prompt-revert-action","sequence":4,"recorded_at":"2026-07-26T01:02:00Z","phase":"revert","outcome":"reverted","executor_identity":"prompt-revert-worker","binding_digest":"sha256:0000000000000000000000000000000000000000000000000000000000000000","quarantine":{"state":"not-applicable","reason_digest":"sha256:3333333333333333333333333333333333333333333333333333333333333333"},"previous_receipt_digest":"sha256:0000000000000000000000000000000000000000000000000000000000000000","receipt_digest":"sha256:0000000000000000000000000000000000000000000000000000000000000000","content_refs":["ref:prompt-revert-candidate"]},
    {"entry_id":"prompt-revert-disarm","sequence":5,"recorded_at":"2026-07-26T01:03:00Z","phase":"controller-disarm","outcome":"controller-disarmed","executor_identity":"prompt-controller","binding_digest":"sha256:0000000000000000000000000000000000000000000000000000000000000000","quarantine":{"state":"not-applicable","reason_digest":"sha256:3333333333333333333333333333333333333333333333333333333333333333"},"previous_receipt_digest":"sha256:0000000000000000000000000000000000000000000000000000000000000000","receipt_digest":"sha256:0000000000000000000000000000000000000000000000000000000000000000","content_refs":["ref:prompt-revert-candidate"]}
  ],"extensions":[]
}
