{
  "kind": "autonomous-mutation-journal", "schema_version": "v1", "journal_id": "micro-route-happy-journal", "domain": "micro-routing", "constitution_digest": "sha256:0000000000000000000000000000000000000000000000000000000000000000",
  "binding": { "mutation_id": "micro-happy-mutation", "attempt_id": "micro-happy-attempt", "controller_disarm_id": "micro-happy-disarm", "idempotency_key": "micro-happy-idem", "owner_identity": "gille-owner", "controller_identity": "micro-route-controller", "watchdog_identity": "micro-route-watchdog", "kill_switch_identity": "micro-route-kill-switch", "recovery_worker_identity": "micro-route-revert-worker", "risk_scope": "micro-routing", "candidate_digest": "sha256:aaaaaaaaaaaaaaaaaaaaaaaaaaaaaaaaaaaaaaaaaaaaaaaaaaaaaaaaaaaaaaaa", "config_digest": "sha256:bbbbbbbbbbbbbbbbbbbbbbbbbbbbbbbbbbbbbbbbbbbbbbbbbbbbbbbbbbbbbbbb", "evidence_digest": "sha256:cccccccccccccccccccccccccccccccccccccccccccccccccccccccccccccccc", "policy_digest": "sha256:dddddddddddddddddddddddddddddddddddddddddddddddddddddddddddddddd", "baseline_digest": "sha256:eeeeeeeeeeeeeeeeeeeeeeeeeeeeeeeeeeeeeeeeeeeeeeeeeeeeeeeeeeeeeeee", "postconditions_digest": "sha256:ffffffffffffffffffffffffffffffffffffffffffffffffffffffffffffffff", "deadline": "2026-07-26T01:00:00Z", "canary": { "scope_digest": "sha256:1111111111111111111111111111111111111111111111111111111111111111", "target_count": 1, "watch_deadline": "2026-07-26T00:30:00Z" }, "recovery": { "class": "R-exact", "worker_identity": "micro-route-revert-worker", "descriptor_digest": "sha256:2222222222222222222222222222222222222222222222222222222222222222", "disarms_after_action": true } },
  "binding_digest": "sha256:0000000000000000000000000000000000000000000000000000000000000000",
  "entries": [
    { "entry_id": "micro-happy-prepare", "sequence": 1, "recorded_at": "2026-07-26T00:00:00Z", "phase": "prepare", "outcome": "prepared", "executor_identity": "micro-route-controller", "binding_digest": "sha256:0000000000000000000000000000000000000000000000000000000000000000", "quarantine": { "state": "not-applicable", "reason_digest": "sha256:3333333333333333333333333333333333333333333333333333333333333333" }, "previous_receipt_digest": null, "receipt_digest": "sha256:0000000000000000000000000000000000000000000000000000000000000000", "content_refs": ["ref:micro-happy-candidate"] },
    { "entry_id": "micro-happy-apply", "sequence": 2, "recorded_at": "2026-07-26T00:05:00Z", "phase": "apply", "outcome": "applied", "executor_identity": "micro-route-controller", "binding_digest": "sha256:0000000000000000000000000000000000000000000000000000000000000000", "quarantine": { "state": "not-applicable", "reason_digest": "sha256:3333333333333333333333333333333333333333333333333333333333333333" }, "previous_receipt_digest": "sha256:0000000000000000000000000000000000000000000000000000000000000000", "receipt_digest": "sha256:0000000000000000000000000000000000000000000000000000000000000000", "content_refs": ["ref:micro-happy-candidate"] },
    { "entry_id": "micro-happy-verify", "sequence": 3, "recorded_at": "2026-07-26T00:10:00Z", "phase": "verify", "outcome": "verified", "executor_identity": "micro-route-controller", "binding_digest": "sha256:0000000000000000000000000000000000000000000000000000000000000000", "quarantine": { "state": "not-applicable", "reason_digest": "sha256:3333333333333333333333333333333333333333333333333333333333333333" }, "previous_receipt_digest": "sha256:0000000000000000000000000000000000000000000000000000000000000000", "receipt_digest": "sha256:0000000000000000000000000000000000000000000000000000000000000000", "content_refs": ["ref:micro-happy-candidate"] },
    { "entry_id": "micro-happy-watch", "sequence": 4, "recorded_at": "2026-07-26T00:30:00Z", "phase": "watch", "outcome": "watching", "executor_identity": "micro-route-controller", "binding_digest": "sha256:0000000000000000000000000000000000000000000000000000000000000000", "quarantine": { "state": "not-applicable", "reason_digest": "sha256:3333333333333333333333333333333333333333333333333333333333333333" }, "previous_receipt_digest": "sha256:0000000000000000000000000000000000000000000000000000000000000000", "receipt_digest": "sha256:0000000000000000000000000000000000000000000000000000000000000000", "content_refs": ["ref:micro-happy-candidate"] },
    { "entry_id": "micro-happy-commit", "sequence": 5, "recorded_at": "2026-07-26T00:40:00Z", "phase": "commit", "outcome": "committed", "executor_identity": "micro-route-controller", "binding_digest": "sha256:0000000000000000000000000000000000000000000000000000000000000000", "quarantine": { "state": "not-applicable", "reason_digest": "sha256:3333333333333333333333333333333333333333333333333333333333333333" }, "previous_receipt_digest": "sha256:0000000000000000000000000000000000000000000000000000000000000000", "receipt_digest": "sha256:0000000000000000000000000000000000000000000000000000000000000000", "content_refs": ["ref:micro-happy-candidate"] },
    { "entry_id": "micro-happy-disarm", "sequence": 6, "recorded_at": "2026-07-26T00:45:00Z", "phase": "controller-disarm", "outcome": "controller-disarmed", "executor_identity": "micro-route-controller", "binding_digest": "sha256:0000000000000000000000000000000000000000000000000000000000000000", "quarantine": { "state": "not-applicable", "reason_digest": "sha256:3333333333333333333333333333333333333333333333333333333333333333" }, "previous_receipt_digest": "sha256:0000000000000000000000000000000000000000000000000000000000000000", "receipt_digest": "sha256:0000000000000000000000000000000000000000000000000000000000000000", "content_refs": ["ref:micro-happy-candidate"] }
  ], "extensions": []
}
